<?xml version="1.0" encoding="UTF-8" ?>

<places
        xmlns="http://ramify.net/places"
        xmlns:xsi="http://www.w3.org/2001/XMLSchema-instance"
        xsi:schemaLocation="http://ramify.net/places ../../../../schema/schema1.xsd">

    <township id="heptonstall">

        <village id="heptonstall" name="Heptonstall">

            <church id="heptonstall-st-thomas" name="St Thomas"/>
            <church id="heptonstall-wesleyan" name="Heptonstall Methodist"/>

        </village>

        <hamlet id="slack" name="Slack">

            <church id="slack-mt-zion" name="Mount Zion"/>
            <farmstead id="robertshaw" name="Robertshaw"/>

        </hamlet>

    </township>

</places>