<?xml version="1.0" encoding="UTF-8" ?>

<places
        xmlns="http://ramify.net/places"
        xmlns:xsi="http://www.w3.org/2001/XMLSchema-instance"
        xsi:schemaLocation="http://ramify.net/places ../../../schema/schema1.xsd">

    <county id="west_yorkshire">

        <manor id="wakefield" name="Wakefield">

            <manor id="halifax" name="Halifax"/>
            <manor id="heptonstall" name="Heptonstall"/>
            <manor id="stansfield" name="Stansfield"/>
            <manor id="wadsworth" name="Wadsworth"/>

        </manor>

        <manor id="pontefract" name="Honour of Pontefract">

        </manor>

    </county>

</places>