<places
        xmlns="http://ramify.net/places"
        xmlns:xsi="http://www.w3.org/2001/XMLSchema-instance"
        xsi:schemaLocation="http://ramify.net/places ../../../../schema/schema1.xsd">

    <township id="wadsworth">

        <church id="wainsgate" name="Wainsgate"/>

        <hamlet id="old_town" name="Old Town"/>

        <hamlet id="shackleton" name="Shackleton"/>

        <village id="pecket_well" name="Pecket Well">
            <church id="crimsworth" name="Crimsworth"/>
        </village>

        <church id="crimsworth_dean" name="Crimsworth Dean"/>

        <farmstead id="high_hirst" name="High Hirst"/>

        <hamlet id="widdop" name="Widdop">
            <farmstead id="lower_houses" name="Lower Houses"/>
            <farmstead id="higher_houses" name="Higher Houses"/>
        </hamlet>

        <hamlet id="walshaw" name="Walshaw"/>

    </township>

</places>