<?xml version="1.0" encoding="UTF-8" ?>

<placePositions
        xmlns="http://ramify.net/places"
        xmlns:xsi="http://www.w3.org/2001/XMLSchema-instance"
        xsi:schemaLocation="http://ramify.net/places ../../../../schema/schema1.xsd">

    <placePoint id="town:hebden_bridge" latitude="53.742" longitude="-2.009"/>

    <placePoint id="chapelry:heptonstall" latitude="53.737632" longitude="-2.071990"/>
    <placePoint id="township:heptonstall" latitude="53.754719" longitude="-2.037193"/>
    <placePoint id="village:heptonstall" latitude="53.748845" longitude="-2.021594"/>
    <placePoint id="church:heptonstall-st-thomas" latitude="53.748845" longitude="-2.021594"/>

    <placePoint id="church:slack-mt-zion" latitude="53.75484" longitude="-2.03663"/>
    <placePoint id="farmstead:robertshaw" latitude="53.75427" longitude="-2.03458"/>

    <placePoint id="church:shore" latitude="53.73595" longitude="-2.1314"/>

</placePositions>